{
  "opera_riferimento": {
    "titolo": "I quaranta giorni del Mussa Dagh",
    "autore": "Franz Werfel"
  },
  "principio_strutturale": "Il saggio è organizzato attorno a sei nuclei tematici (cinque numerati più una sezione conclusiva), preceduti da un'apertura che pone la domanda guida — quale scala richiede il romanzo per essere letto, fra epopea e referto — e seguiti da una breve nota sul metodo. La sequenza segue una logica di complessità crescente: parte dal dato più piccolo e più visibile (lo scarto del numero nel titolo), passa al cuore della tesi (la costituzione di un mondo umano sull'altipiano), articola la configurazione interna della comunità (la triplicazione dell'autorità), allarga lo sguardo alla configurazione storica entro cui la vicenda accade (la macchina amministrativa dello sterminio nei capitoli di Lepsius), affronta la contro-lettura più seria (l'inefficacia della resistenza misurata sul bilancio strategico) e si chiude sul nodo finale (il significato della morte di Gabriel come fedeltà a un resto). Ciascun nucleo intreccia due dimensioni — l'affermazione critica sull'opera e il movimento di pensiero attraverso cui quell'affermazione ha preso forma — variando la tecnica di intreccio per evitare uniformità. La nota sul metodo, alla chiusura, descrive in termini neutri il processo svolto, senza commenti su cosa il metodo cerchi o non cerchi di dimostrare.",
  "nuclei_tematici": [
    {
      "titolo": "Uno scarto nel titolo: il tempo come figura",
      "dimensione_interpretativa": "Il numero quaranta del titolo non corrisponde alla durata storica della resistenza (circa cinquantatré giorni, luglio-settembre 1915): è scelta deliberata che innesta la vicenda in una grammatica figurale biblica — diluvio, Sinai, Quaresima, tentazioni nel deserto — e trasforma l'episodio in tempo della prova. La durata sul Musa Dagh diventa figura del tempo umano sotto minaccia di cancellazione, non cronaca di un assedio.",
      "dimensione_di_processo": "È il primo orientamento dell'intera analisi, raccolto nella ricognizione iniziale dei contenuti. Ha riorientato la postura di lettura prima di qualsiasi altra cosa: dalla domanda 'che ne è dell'assedio?' a quella 'che tipo di temporalità il romanzo costruisce, e perché?'. Il piccolo dettaglio del titolo si è rivelato un atto interpretativo macroscopico.",
      "tecnica_di_intreccio": "opera-poi-processo"
    },
    {
      "titolo": "La costituzione di un mondo umano sull'altipiano",
      "dimensione_interpretativa": "La sproporzione tra spazio dedicato all'organizzazione interna dell'accampamento (consiglio dei capi, ospedale, scuola, riti, milizia) e spazio dedicato agli scontri militari è essa stessa interpretazione. Il romanzo lavora sulla costituzione di una forma piena di esistenza collettiva — non sulla sopravvivenza biologica. La comunità non costituisce un mondo e poi incontra il limite: lo costituisce mentre lo incontra, secondo l'architettura tripartita 'Untergang — Rettung — Untergang' del Libro terzo.",
      "dimensione_di_processo": "Ipotesi emersa in una prima lettura libera attenta alle tensioni del materiale, poi precisata da una lettura strutturata. La sorpresa di questa fase è stata la centralità dell'asse della separazione e del limite: la lettura si aspettava il primato della costituzione del soggetto collettivo, e ha invece trovato la costituzione e l'incontro con il limite come un'unica tensione sostenuta. La tesi è stata di conseguenza riformulata da 'costituzione di un mondo umano' a 'costituzione di un mondo umano contro la propria decretata cancellazione, e nella sua perdurante esposizione'.",
      "tecnica_di_intreccio": "opera-poi-processo"
    },
    {
      "titolo": "Tre figure, tre risposte non riconciliate",
      "dimensione_interpretativa": "Ter Haigasun, Gabriel Bagradian e Sarkis Kilikian rappresentano tre risposte legittime e non risolte alla minaccia di annientamento — rito, strategia, furia — che il romanzo mantiene in conflitto senza scegliere. Il processo a Kilikian, che lo sanziona ma non lo espelle, mostra che la comunità si tiene insieme dentro una contraddizione interna che la costituisce. Senza Kilikian la resistenza diventerebbe leggenda di sé; con lui resta storia opaca, contraddittoria, esposta.",
      "dimensione_di_processo": "La figura di Kilikian è stata letta come funzione strutturale della configurazione, non come deviazione da neutralizzare. È stata una delle decisioni interpretative più significative del percorso: la tradizione del romanzo storico ottocentesco avrebbe suggerito di eliminarlo; Werfel lo tiene dentro, e l'analisi ha riconosciuto in questa scelta una delle maturità maggiori del libro.",
      "tecnica_di_intreccio": "parallelo"
    },
    {
      "titolo": "La macchina amministrativa dello sterminio",
      "dimensione_interpretativa": "I capitoli di Johannes Lepsius — pastore protestante tedesco realmente esistito che tenta di smuovere le cancellerie europee — non sono digressione ma secondo pilastro dell'architettura del romanzo. Werfel mostra che lo sterminio del Novecento non è anzitutto pulsione o furore ma dispositivo amministrativo: telefoni, archivi, ferrovie, ministeri, registri di deportazione. La diplomazia europea silenziosa è l'altra forma della stessa macchina, quella per cui la normatività internazionale esiste come pura procedura senza essere all'altezza del reale. Il libro, scritto nel 1933 da un ebreo praghese, descrive con precisione una forma di violenza che il Novecento riconoscerà come propria firma.",
      "dimensione_di_processo": "Nel percorso interpretativo, i capitoli di Lepsius hanno richiesto una decisione esplicita. Erano facilmente trattabili come digressione storico-documentaria trascurabile rispetto al cuore romanzesco dell'altipiano. Si è scelto al contrario di leggerli come co-costitutivi: senza di essi non si vede la struttura della violenza che il Musa Dagh subisce, e la salvezza finale apparirebbe come puro deus ex machina invece che come arrivo tardivo di un'Europa che aveva chiuso le porte mesi prima.",
      "tecnica_di_intreccio": "opera-poi-processo"
    },
    {
      "titolo": "La salvezza che non chiude: la contro-lettura e la sua coabitazione",
      "dimensione_interpretativa": "La contro-lettura più rigorosa sostiene che la resistenza del Musa Dagh, sul bilancio storico, è stata un fallimento: i sopravvissuti vengono salvati per puro caso dalla flotta franco-britannica, Stephan e Gabriel muoiono, i villaggi sono cancellati comunque, il genocidio prosegue altrove. La contro-lettura coglie qualcosa di reale ma misura su una scala che non è la scala su cui Werfel lavora: quella dell'esito strategico, non quella della costituzione del mondo umano. La distinzione decisiva è tra 'essere salvati' e 'aver dato senso al proprio tempo': la salvezza biologica non chiude il senso dei quaranta giorni. Lettura principale e contro-lettura coabitano come la tensione propria dell'opera, iscritta nella formula 'Untergang — Rettung — Untergang'.",
      "dimensione_di_processo": "È stata la decisione interpretativa più difficile dell'intero percorso. Più facile sarebbe stato scegliere — celebrare o denunciare. La tesi è stata salvata non confutando la contro-lettura ma tenendola accanto, e formulando la distinzione tra 'essere salvati' e 'aver dato senso al proprio tempo'. Questa formulazione è venuta a fare il lavoro che né la celebrazione né la denuncia potevano fare.",
      "tecnica_di_intreccio": "parallelo"
    }
  ],
  "testo_integrato": {
    "titolo": "Quaranta giorni di mondo umano",
    "sottotitolo": "Sul Musa Dagh di Werfel come tempo della prova",